{
  "$schema": "http://json-schema.org/draft-07/schema#",
  "title": "OpenTofu Ansible Inventory",
  "description": "Schema for the tofu_inventory.json output consumed by ansible-proxmox-apps",
  "type": "object",
  "required": [
    "containers",
    "vms",
    "docker_vms",
    "splunk_vm",
    "constants",
    "ingress",
    "host_services",
    "nodes",
    "node_storage",
    "domain"
  ],
  "additionalProperties": true,
  "properties": {
    "containers": {
      "type": "object",
      "description": "LXC containers managed by OpenTofu",
      "additionalProperties": {
        "$ref": "#/definitions/container_entry"
      }
    },
    "vms": {
      "type": "object",
      "description": "Regular VMs managed by OpenTofu (may be empty)",
      "additionalProperties": {
        "$ref": "#/definitions/vm_entry"
      }
    },
    "docker_vms": {
      "type": "object",
      "description": "VMs with the docker tag \u2014 subset of vms",
      "additionalProperties": {
        "$ref": "#/definitions/vm_entry"
      }
    },
    "splunk_vm": {
      "type": "object",
      "description": "Splunk VM entry, keyed by name",
      "additionalProperties": {
        "$ref": "#/definitions/splunk_entry"
      },
      "minProperties": 1
    },
    "constants": {
      "$ref": "#/definitions/constants"
    },
    "domain": {
      "type": "string",
      "description": "Internal DNS domain from a tofu variable"
    },
    "cache_proxy_urls": {
      "type": "object",
      "description": "Proxy URLs derived from published capability-tagged guests",
      "required": ["apt_cache"],
      "properties": {
        "apt_cache": {
          "type": "array",
          "items": {
            "type": "string",
            "format": "uri"
          }
        }
      },
      "additionalProperties": false
    },
    "host_services": {
      "type": "object",
      "description": "Host-level NAS service config consumed by ansible-proxmox",
      "properties": {
        "nas": {
          "type": "object",
          "properties": {
            "zfs_dataset": {
              "type": "string"
            },
            "zfs_quota": {
              "type": "string"
            },
            "mount_point": {
              "type": "string"
            },
            "smb_share_name": {
              "type": "string"
            },
            "directories": {
              "type": "array",
              "items": {
                "type": "string"
              }
            },
            "description": {
              "type": "string"
            }
          }
        }
      }
    },
    "ingress": {
      "type": "array",
      "description": "Traefik ingress route table from OpenTofu \u2014 one {name, ip, port} per fronted service UI",
      "items": {
        "type": "object",
        "additionalProperties": true,
        "description": "Either a single-backend service route {name, ip, port} (ip is a dotted IPv4 or a hostname/FQDN for DHCP-first guests) or a multi-backend HA pool {name, backends, port} with no single ip \u2014 covering both the Proxmox-UI apex pool (apex: true) and non-apex load-balanced pools such as OpenBao and the LiteLLM router.",
        "anyOf": [
          {
            "required": [
              "name",
              "ip",
              "port"
            ],
            "properties": {
              "name": {
                "type": "string",
                "minLength": 1
              },
              "ip": {
                "type": "string",
                "minLength": 1
              },
              "port": {
                "type": "integer",
                "minimum": 1,
                "maximum": 65535
              }
            }
          },
          {
            "required": [
              "name",
              "backends",
              "port"
            ],
            "properties": {
              "name": {
                "type": "string",
                "minLength": 1
              },
              "apex": {
                "const": true
              },
              "backends": {
                "type": "array",
                "minItems": 1,
                "items": {
                  "type": "string",
                  "minLength": 1
                }
              },
              "port": {
                "type": "integer",
                "minimum": 1,
                "maximum": 65535
              }
            }
          }
        ]
      }
    },
    "nodes": {
      "type": "object",
      "description": "Cluster node inventory passthrough from OpenTofu (var.nodes)",
      "minProperties": 1
    },
    "node_storage": {
      "type": "object",
      "description": "Per-node ZFS storage passthrough from OpenTofu (var.node_storage)"
    }
  },
  "definitions": {
    "container_entry": {
      "type": "object",
      "required": [
        "vmid",
        "ip",
        "hostname",
        "ansible_connection",
        "fqdn",
        "tags",
        "node",
        "ansible_pct_vmid"
      ],
      "additionalProperties": true,
      "properties": {
        "vmid": {
          "type": "integer",
          "minimum": 100
        },
        "ip": {
          "type": "string",
          "description": "Static guests: IPv4 address. DHCP-first guests: hostname/FQDN (DNS A record resolves to the DHCP reservation).",
          "anyOf": [
            {
              "type": "string",
              "pattern": "^\\d{1,3}\\.\\d{1,3}\\.\\d{1,3}\\.\\d{1,3}$"
            },
            {
              "type": "string",
              "pattern": "^[a-z0-9]([a-z0-9-]*[a-z0-9])?(\\.[a-z0-9]([a-z0-9-]*[a-z0-9])?)+$"
            }
          ]
        },
        "mac": {
          "type": [
            "string",
            "null"
          ],
          "pattern": "^([0-9a-f]{2}:){5}[0-9a-f]{2}$",
          "description": "Deterministic locally-administered MAC for DHCP-first guests (02: prefix); null for static guests."
        },
        "hostname": {
          "type": "string",
          "minLength": 1
        },
        "ansible_connection": {
          "type": "string",
          "enum": [
            "community.proxmox.proxmox_pct_remote",
            "ssh"
          ],
          "description": "Default transport is proxmox_pct_remote for every container unless explicitly flipped to ssh (direct OpenSSH via SSH-CA trust)."
        },
        "fqdn": {
          "type": "string",
          "minLength": 1,
          "description": "The container's stable DNS name, published unconditionally for every container. Required as ansible_host when ansible_connection is ssh."
        },
        "ansible_pct_vmid": {
          "type": "integer",
          "minimum": 100
        },
        "tags": {
          "type": "array",
          "items": {
            "type": "string"
          }
        },
        "node": {
          "type": "string",
          "minLength": 1
        },
        "pool_id": {
          "type": "string",
          "minLength": 1
        }
      }
    },
    "vm_entry": {
      "type": "object",
      "required": [
        "vmid",
        "ip",
        "hostname",
        "ansible_connection",
        "tags",
        "node"
      ],
      "additionalProperties": true,
      "properties": {
        "vmid": {
          "type": "integer",
          "minimum": 100
        },
        "ip": {
          "anyOf": [
            {
              "type": "string",
              "pattern": "^\\d{1,3}\\.\\d{1,3}\\.\\d{1,3}\\.\\d{1,3}$"
            },
            {
              "type": "string",
              "pattern": "^[a-z0-9]([a-z0-9-]*[a-z0-9])?(\\.[a-z0-9]([a-z0-9-]*[a-z0-9])?)+$"
            }
          ]
        },
        "hostname": {
          "type": "string",
          "minLength": 1
        },
        "ansible_connection": {
          "type": "string",
          "enum": [
            "ssh"
          ]
        },
        "tags": {
          "type": "array",
          "items": {
            "type": "string"
          }
        },
        "node": {
          "type": "string",
          "minLength": 1
        },
        "pool_id": {
          "type": "string",
          "minLength": 1
        }
      }
    },
    "splunk_entry": {
      "type": "object",
      "required": [
        "vmid",
        "ip",
        "hostname",
        "ansible_connection",
        "node"
      ],
      "additionalProperties": true,
      "properties": {
        "vmid": {
          "type": "integer",
          "minimum": 100
        },
        "ip": {
          "type": "string",
          "pattern": "^\\d{1,3}\\.\\d{1,3}\\.\\d{1,3}\\.\\d{1,3}$"
        },
        "hostname": {
          "type": "string",
          "minLength": 1
        },
        "ansible_connection": {
          "type": "string",
          "enum": [
            "ssh"
          ]
        },
        "node": {
          "type": "string",
          "minLength": 1
        }
      }
    },
    "constants": {
      "type": "object",
      "required": [
        "service_ports",
        "syslog_ports",
        "syslog_port_map",
        "netflow_ports",
        "notification_ports",
        "vector_db_ports",
        "media_ports",
        "ai_log_ports",
        "ai_log_routing"
      ],
      "additionalProperties": true,
      "properties": {
        "service_ports": {
          "type": "object",
          "properties": {
            "haproxy_stats": {
              "type": "integer",
              "minimum": 1,
              "maximum": 65535
            },
            "splunk_web": {
              "type": "integer",
              "minimum": 1,
              "maximum": 65535
            },
            "splunk_hec": {
              "type": "integer",
              "minimum": 1,
              "maximum": 65535
            },
            "splunk_mgmt": {
              "type": "integer",
              "minimum": 1,
              "maximum": 65535
            },
            "cribl_edge_api": {
              "type": "integer",
              "minimum": 1,
              "maximum": 65535
            },
            "cribl_stream_api": {
              "type": "integer",
              "minimum": 1,
              "maximum": 65535
            },
            "apt_cacher_ng": {
              "type": "integer",
              "minimum": 1,
              "maximum": 65535
            }
          },
          "required": [
            "haproxy_stats",
            "splunk_web",
            "splunk_hec",
            "splunk_mgmt",
            "cribl_edge_api",
            "cribl_stream_api"
          ],
          "additionalProperties": {
            "type": "integer",
            "minimum": 1,
            "maximum": 65535
          }
        },
        "syslog_ports": {
          "type": "object",
          "properties": {
            "unifi": {
              "type": "integer",
              "minimum": 1,
              "maximum": 65535
            },
            "palo_alto": {
              "type": "integer",
              "minimum": 1,
              "maximum": 65535
            },
            "cisco_asa": {
              "type": "integer",
              "minimum": 1,
              "maximum": 65535
            },
            "linux": {
              "type": "integer",
              "minimum": 1,
              "maximum": 65535
            },
            "windows": {
              "type": "integer",
              "minimum": 1,
              "maximum": 65535
            }
          },
          "required": [
            "unifi",
            "palo_alto",
            "cisco_asa",
            "linux",
            "windows"
          ],
          "additionalProperties": {
            "type": "integer",
            "minimum": 1,
            "maximum": 65535
          }
        },
        "syslog_port_map": {
          "description": "Per-family syslog routing map: standard app-facing frontend port, high backend port, and Splunk index/sourcetype. The single source of truth consumed by the HAProxy and Cribl Edge roles, the validate playbook, and the pytest E2E fixtures.",
          "type": "object",
          "additionalProperties": {
            "type": "object",
            "properties": {
              "standard": {
                "type": "integer",
                "minimum": 1,
                "maximum": 65535
              },
              "high": {
                "type": "integer",
                "minimum": 1,
                "maximum": 65535
              },
              "index": {
                "type": "string",
                "minLength": 1
              },
              "sourcetype": {
                "type": "string",
                "minLength": 1
              }
            },
            "required": [
              "standard",
              "high",
              "index",
              "sourcetype"
            ],
            "additionalProperties": false
          }
        },
        "ai_log_ports": {
          "description": "Per-source AI/LLM ingest port map (name -> HAProxy-fronted TCP port). Flat convenience view of ai_log_routing for consumers that only need the port.",
          "type": "object",
          "additionalProperties": {
            "type": "integer",
            "minimum": 1,
            "maximum": 65535
          }
        },
        "ai_log_routing": {
          "description": "Per-source AI/LLM log routing map: HAProxy-fronted TCP port plus the Splunk index/sourcetype Cribl Stream's ai_stamp pipeline stamps. Single source of truth consumed by the haproxy and cribl_stream roles and the pytest E2E fixtures.",
          "type": "object",
          "additionalProperties": {
            "type": "object",
            "properties": {
              "port": {
                "type": "integer",
                "minimum": 1,
                "maximum": 65535
              },
              "index": {
                "type": "string",
                "minLength": 1
              },
              "sourcetype": {
                "type": "string",
                "minLength": 1
              }
            },
            "required": [
              "port",
              "index",
              "sourcetype"
            ],
            "additionalProperties": false
          }
        },
        "netflow_ports": {
          "type": "object",
          "properties": {
            "unifi": {
              "type": "integer",
              "minimum": 1,
              "maximum": 65535
            }
          },
          "required": [
            "unifi"
          ],
          "additionalProperties": {
            "type": "integer",
            "minimum": 1,
            "maximum": 65535
          }
        },
        "notification_ports": {
          "type": "object",
          "properties": {
            "mailpit_smtp": {
              "type": "integer",
              "minimum": 1,
              "maximum": 65535
            },
            "mailpit_web": {
              "type": "integer",
              "minimum": 1,
              "maximum": 65535
            },
            "ntfy_http": {
              "type": "integer",
              "minimum": 1,
              "maximum": 65535
            }
          },
          "required": [
            "mailpit_smtp",
            "mailpit_web",
            "ntfy_http"
          ],
          "additionalProperties": {
            "type": "integer",
            "minimum": 1,
            "maximum": 65535
          }
        },
        "vector_db_ports": {
          "type": "object",
          "properties": {
            "qdrant_http": {
              "type": "integer",
              "minimum": 1,
              "maximum": 65535
            },
            "qdrant_grpc": {
              "type": "integer",
              "minimum": 1,
              "maximum": 65535
            }
          },
          "required": [
            "qdrant_http",
            "qdrant_grpc"
          ],
          "additionalProperties": {
            "type": "integer",
            "minimum": 1,
            "maximum": 65535
          }
        },
        "media_ports": {
          "type": "object",
          "properties": {
            "qbittorrent_web": {
              "type": "integer",
              "minimum": 1,
              "maximum": 65535
            },
            "prowlarr_web": {
              "type": "integer",
              "minimum": 1,
              "maximum": 65535
            },
            "sonarr_web": {
              "type": "integer",
              "minimum": 1,
              "maximum": 65535
            },
            "radarr_web": {
              "type": "integer",
              "minimum": 1,
              "maximum": 65535
            },
            "plex_web": {
              "type": "integer",
              "minimum": 1,
              "maximum": 65535
            },
            "seerr_web": {
              "type": "integer",
              "minimum": 1,
              "maximum": 65535
            }
          },
          "required": [
            "qbittorrent_web",
            "prowlarr_web"
          ],
          "additionalProperties": {
            "type": "integer",
            "minimum": 1,
            "maximum": 65535
          }
        }
      }
    }
  }
}
