{
  "containers": {
    "haproxy": {
      "vmid": 175,
      "ip": "192.168.0.175",
      "mac": null,
      "hostname": "haproxy",
      "ansible_connection": "community.proxmox.proxmox_pct_remote",
      "ansible_pct_vmid": 175,
      "tags": [
        "terraform",
        "container",
        "haproxy",
        "pipeline",
        "infrastructure"
      ],
      "node": "node-p",
      "pool_id": "homelab",
      "fqdn": "haproxy.jacobpevans.com"
    },
    "cribl-edge-01": {
      "vmid": 180,
      "ip": "192.168.0.180",
      "hostname": "cribl-edge-01",
      "ansible_connection": "community.proxmox.proxmox_pct_remote",
      "ansible_pct_vmid": 180,
      "tags": [
        "terraform",
        "container",
        "cribl",
        "edge",
        "pipeline",
        "logging",
        "managed-secrets"
      ],
      "node": "node-p",
      "pool_id": "homelab",
      "fqdn": "cribl-edge-01.jacobpevans.com"
    },
    "cribl-edge-02": {
      "vmid": 181,
      "ip": "192.168.0.181",
      "hostname": "cribl-edge-02",
      "ansible_connection": "community.proxmox.proxmox_pct_remote",
      "ansible_pct_vmid": 181,
      "tags": [
        "terraform",
        "container",
        "cribl",
        "edge",
        "pipeline",
        "logging",
        "managed-secrets"
      ],
      "node": "node-p",
      "pool_id": "homelab",
      "fqdn": "cribl-edge-02.jacobpevans.com"
    },
    "mssql": {
      "vmid": 130,
      "ip": "192.168.0.130",
      "hostname": "mssql",
      "ansible_connection": "community.proxmox.proxmox_pct_remote",
      "ansible_pct_vmid": 130,
      "tags": [
        "database"
      ],
      "node": "node-p",
      "pool_id": "homelab",
      "fqdn": "mssql.jacobpevans.com"
    },
    "cribl-stream-01": {
      "vmid": 182,
      "ip": "192.168.0.182",
      "hostname": "cribl-stream-01",
      "ansible_connection": "community.proxmox.proxmox_pct_remote",
      "ansible_pct_vmid": 182,
      "tags": [
        "terraform",
        "container",
        "cribl",
        "stream",
        "pipeline",
        "logging",
        "managed-secrets"
      ],
      "node": "node-p",
      "pool_id": "homelab",
      "fqdn": "cribl-stream-01.jacobpevans.com"
    },
    "cribl-stream-02": {
      "vmid": 183,
      "ip": "192.168.0.183",
      "hostname": "cribl-stream-02",
      "ansible_connection": "community.proxmox.proxmox_pct_remote",
      "ansible_pct_vmid": 183,
      "tags": [
        "terraform",
        "container",
        "cribl",
        "stream",
        "pipeline",
        "logging",
        "managed-secrets"
      ],
      "node": "node-p",
      "pool_id": "homelab",
      "fqdn": "cribl-stream-02.jacobpevans.com"
    },
    "qdrant": {
      "vmid": 165,
      "ip": "192.168.0.165",
      "hostname": "qdrant",
      "ansible_connection": "community.proxmox.proxmox_pct_remote",
      "ansible_pct_vmid": 165,
      "tags": [
        "terraform",
        "container",
        "vectordb",
        "ai",
        "docker"
      ],
      "node": "node-p",
      "pool_id": "ai",
      "fqdn": "qdrant.jacobpevans.com"
    },
    "mailpit": {
      "vmid": 110,
      "ip": "192.168.0.110",
      "hostname": "mailpit",
      "ansible_connection": "community.proxmox.proxmox_pct_remote",
      "ansible_pct_vmid": 110,
      "tags": [
        "terraform",
        "container",
        "smtp",
        "notifications"
      ],
      "node": "node-p",
      "pool_id": "homelab",
      "fqdn": "mailpit.jacobpevans.com"
    },
    "ntfy": {
      "vmid": 111,
      "ip": "192.168.0.111",
      "hostname": "ntfy",
      "ansible_connection": "community.proxmox.proxmox_pct_remote",
      "ansible_pct_vmid": 111,
      "tags": [
        "terraform",
        "container",
        "push",
        "notifications",
        "managed-secrets"
      ],
      "node": "node-p",
      "pool_id": "homelab",
      "fqdn": "ntfy.jacobpevans.com"
    },
    "openproject": {
      "vmid": 140,
      "ip": "192.168.0.140",
      "hostname": "openproject",
      "ansible_connection": "community.proxmox.proxmox_pct_remote",
      "ansible_pct_vmid": 140,
      "tags": [
        "terraform",
        "container",
        "openproject",
        "projects",
        "docker"
      ],
      "node": "node-p",
      "pool_id": "infrastructure",
      "fqdn": "openproject.jacobpevans.com"
    },
    "download-vpn": {
      "vmid": 210,
      "ip": "192.168.0.210",
      "hostname": "download-vpn",
      "ansible_connection": "community.proxmox.proxmox_pct_remote",
      "ansible_pct_vmid": 210,
      "tags": [
        "terraform",
        "container",
        "media",
        "download",
        "vpn",
        "torrent",
        "indexer"
      ],
      "node": "node-b",
      "pool_id": "media",
      "fqdn": "download-vpn.jacobpevans.com"
    },
    "sonarr": {
      "vmid": 211,
      "ip": "192.168.0.211",
      "hostname": "sonarr",
      "ansible_connection": "community.proxmox.proxmox_pct_remote",
      "ansible_pct_vmid": 211,
      "tags": [
        "terraform",
        "container",
        "media",
        "sonarr",
        "pvr"
      ],
      "node": "node-b",
      "pool_id": "media",
      "fqdn": "sonarr.jacobpevans.com"
    },
    "radarr": {
      "vmid": 212,
      "ip": "192.168.0.212",
      "hostname": "radarr",
      "ansible_connection": "community.proxmox.proxmox_pct_remote",
      "ansible_pct_vmid": 212,
      "tags": [
        "terraform",
        "container",
        "media",
        "radarr",
        "pvr"
      ],
      "node": "node-b",
      "pool_id": "media",
      "fqdn": "radarr.jacobpevans.com"
    },
    "plex": {
      "vmid": 213,
      "ip": "plex.example.internal",
      "mac": "02:00:c0:a8:00:d5",
      "hostname": "plex",
      "ansible_connection": "community.proxmox.proxmox_pct_remote",
      "ansible_pct_vmid": 213,
      "tags": [
        "terraform",
        "container",
        "media",
        "plex",
        "streaming"
      ],
      "node": "node-b",
      "pool_id": "media",
      "fqdn": "plex.jacobpevans.com"
    },
    "seerr": {
      "vmid": 214,
      "ip": "192.168.0.214",
      "hostname": "seerr",
      "ansible_connection": "community.proxmox.proxmox_pct_remote",
      "ansible_pct_vmid": 214,
      "tags": [
        "terraform",
        "container",
        "media",
        "request",
        "seerr"
      ],
      "node": "node-b",
      "pool_id": "media",
      "fqdn": "seerr.jacobpevans.com"
    },
    "immich": {
      "vmid": 220,
      "ip": "immich.example.net",
      "hostname": "immich",
      "mac": "02:22:2f:d1:05:fe",
      "ansible_connection": "community.proxmox.proxmox_pct_remote",
      "ansible_pct_vmid": 220,
      "tags": [
        "terraform",
        "container",
        "immich",
        "managed-secrets"
      ],
      "node": "node-p",
      "pool_id": "media",
      "fqdn": "immich.jacobpevans.com"
    },
    "apt-cacher-ng-10": {
      "vmid": 613010,
      "ip": "apt-cacher-ng-10.example.internal",
      "mac": "02:00:c0:a8:0a:0a",
      "hostname": "apt-cacher-ng-10",
      "ansible_connection": "community.proxmox.proxmox_pct_remote",
      "ansible_pct_vmid": 613010,
      "tags": [
        "apt-cache",
        "container",
        "infrastructure",
        "terraform"
      ],
      "node": "node-a",
      "pool_id": "infrastructure",
      "fqdn": "apt-cacher-ng-10.jacobpevans.com"
    },
    "apt-cacher-ng-30": {
      "vmid": 613030,
      "ip": "apt-cacher-ng-30.example.internal",
      "mac": "02:00:c0:a8:0a:1e",
      "hostname": "apt-cacher-ng-30",
      "ansible_connection": "community.proxmox.proxmox_pct_remote",
      "ansible_pct_vmid": 613030,
      "tags": [
        "apt-cache",
        "container",
        "infrastructure",
        "terraform"
      ],
      "node": "node-c",
      "pool_id": "infrastructure",
      "fqdn": "apt-cacher-ng-30.jacobpevans.com"
    }
  },
  "vms": {},
  "docker_vms": {
    "docker-host": {
      "vmid": 250,
      "ip": "192.168.0.250",
      "hostname": "docker-host",
      "ansible_connection": "ssh",
      "tags": [
        "terraform",
        "cribl",
        "docker",
        "logging",
        "swarm"
      ],
      "node": "node-p",
      "pool_id": "homelab"
    },
    "iac-platform": {
      "vmid": 251,
      "ip": "192.168.0.251",
      "hostname": "iac-platform",
      "ansible_connection": "ssh",
      "tags": [
        "terraform",
        "semaphore",
        "terrakube",
        "docker"
      ],
      "node": "node-p",
      "pool_id": "homelab"
    },
    "ai-sandbox-01": {
      "vmid": 252,
      "ip": "192.168.0.252",
      "hostname": "ai-sandbox-01",
      "ansible_connection": "ssh",
      "tags": [
        "terraform",
        "docker",
        "agent-sandbox",
        "managed-secrets"
      ],
      "node": "node-p",
      "pool_id": "homelab"
    }
  },
  "splunk_vm": {
    "splunk": {
      "vmid": 200,
      "ip": "192.168.0.200",
      "hostname": "splunk",
      "ansible_connection": "ssh",
      "node": "node-p"
    }
  },
  "constants": {
    "service_ports": {
      "haproxy_stats": 8404,
      "splunk_web": 8000,
      "splunk_hec": 8088,
      "splunk_mgmt": 8089,
      "cribl_edge_api": 9000,
      "cribl_stream_api": 9100,
      "cribl_s2s": 10300,
      "apt_cacher_ng": 3142,
      "openbao_api": 8200,
      "agentgateway_metrics": 15020
    },
    "syslog_ports": {
      "unifi": 1514,
      "palo_alto": 1515,
      "cisco_asa": 1516,
      "linux": 1517,
      "windows": 1518
    },
    "netflow_ports": {
      "unifi": 2055
    },
    "ai_log_ports": {
      "claude_code": 10311,
      "codex_cli": 10312,
      "agy_cli": 10313,
      "copilot_cli": 10314,
      "vscode": 10315,
      "macstudio_llm": 10321,
      "macstudio_gate": 10322,
      "homelab_llm": 10323,
      "openbao_audit": 10331,
      "agentgateway_docker": 10341,
      "dify_docker": 10342,
      "hindsight_docker": 10343,
      "langflow_docker": 10344,